영화인 코드,영화인명,분야,필모리스트
10038689,존 왓츠(Jon Watts),감독,"스파이더맨: 파 프롬 홈, 스파이더맨: 홈 커밍, 캅카"
10000296,가이 리치(Guy Ritchie),감독,"알라딘, 킹 아서: 제왕의 검, 맨 프롬 UNCLE, 셜록홈즈 : 그림자 게임, 셜록 홈즈, 락큰롤라, 리볼버, 스웹트 어웨이, 스내치, 록 스탁 앤 2 스모킹 배럴즈"
10023314,조시 쿨리(Josh Cooley),감독,토이 스토리 4
20209287,남대중(NAM Dae-joong),감독,"기방도령, 위대한 소원"
10031641,봉준호(BONG Joon-ho),감독,"기생충, 옥자, 해무(海霧), 설국열차, 토니 레인즈의 한국영화 25년, 마더, 감독들, 김기영을 말하다, 괴물, 남극일기, 살인의 추억, 이공, 피도 눈물도 없이, 플란다스의 개, 유령, 모텔 선인장, 인플루엔자, 싱크 & 라이즈, 백색인, 지리멸렬, 프레임 속의 기억들, 인디포럼2014 필름1, 도쿄!"
10090941,히라야마 미호(Miho Hirayama),감독,극장판 엉덩이 탐정: 화려한 사건 수첩
10018162,게리 도버먼(Gary Dauberman),감독,애나벨 집으로
10021926,아리 애스터(Ari Aster),감독,"미드소마, 유전"
20135271,강윤성(KANG Yun-sung),감독,"롱 리브 더 킹: 목포 영웅, 범죄도시, 영어완전정복"
10066410,로버트 페르난데스(Robert Fernandez),감독,천로역정: 천국을 찾아서
10057331,이정호(LEE Jeong-ho),감독,"비스트, 방황하는 칼날, 베스트셀러, 용서는 없다, 슈퍼맨이었던 사나이, 좋지 아니한가, 흡혈형사 나도열, 령, 청풍명월(淸風明月), 마고, 물위의 하룻밤"
10009058,닐 조단(Neil Jordan),감독,"마담 싸이코, 온딘, 브레이브 원, 플루토에서 아침을, 더블 다운, 사랑의 슬픔 애수, 인드림스, 푸줏간 소년 , 마이클 콜린스 , 뱀파이어와의 인터뷰 , 크라잉 게임, 두번째 이별, 모나리자"
10091258,F. 게리 그레이(F. Gary Gray),감독,"맨 인 블랙: 인터내셔널, 분노의 질주: 더 익스트림, 스트레이트 아웃 오브 컴턴, 모범시민, 쿨, 빈 디젤의 디아블로, 이탈리안 잡, 네고시에이터, 셋잇오프 "
10008737,라스 클리브버그(Lars Klevberg),감독,"사탄의 인형, 폴라로이드"
10027082,미미 레더(Mimi Leder),감독,"세상을 바꾼 변호인, 코드, 사라 실종 사건, 아름다운 세상을 위하여, 딥 임팩트, 피스메이커"
10027387,미야자키 하야오(Hayao Miyazaki),감독,"바람이 분다, 벼랑 위의 포뇨, 하울의 움직이는 성, 붉은 돼지, 센과 치히로의 행방불명, 모노노케 히메, 마녀배달부 키키, 이웃집 토토로, 천공의 성 라퓨타, 바람계곡의 나우시카, 루팡 3세: 칼리오스트로의 성, 팬더와 친구들의 모험"
10009032,닐 버거(Neil Burger),감독,"업사이드, 다이버전트, 리미트리스, 럭키 원스, 일루셔니스트"
10043421,안소니 루소(Anthony Russo),감독,"어벤져스: 엔드게임, 어벤져스: 인피니티 워, 캡틴 아메리카: 시빌 워, 캡틴 아메리카: 윈터 솔져, 허니문크래셔, 웰컴 투 콜린우드"
20131414,이원태(LEE Won-tae),감독,"악인전, 대장 김창수, 조선마술사, 가비, 파파, 오싹한 연애"
10022882,마이클 도허티(Michael Dougherty),감독,"고질라: 킹 오브 몬스터, 트릭 오어 트릿"
10069970,신우(Shen Yu),감독,"빅샤크2: 해저2만리, 토이 가디언즈"
10053709,유선동(YOU Sun-dong),감독,"0.0MHz, 내 심장을 쏴라, 고死 두 번째 이야기: 교생실습, 미스터 주부퀴즈왕, 아라한 장풍대작전, 샌드위치"
20186696,정다원(JUNG Da-won),감독,"걸캅스, 목숨 건 연애, 장기왕 : 가락시장 레볼루션, 자유의 언덕, 우리 선희, 누구의 딸도 아닌 해원"
10060063,장규성(JANG Kyu-sung),감독,"어린 의뢰인, 바람 바람 바람, 나는 왕이로소이다, 이장과 군수, 여선생 VS 여제자, 선생 김봉두, 재밌는 영화"
20322109,이호경,감독,교회오빠
10043278,데이빗 야로베스키(David Yarovesky),감독,"더 보이, 더 하이브"
20314390,홍승완(HONG Seung-wan),감독,배심원들
10018169,롭 레터맨(Rob Letterman),감독,"명탐정 피카츄, 구스범스, 걸리버 여행기, 몬스터 vs 에이리언, 샤크"
10054185,육상효(YOOK Sang-hyo),감독,"나의 특별한 형제, 화장, 강철대오:구국의 철가방, 방가? 방가!, 여자, 정혜, 달마야, 서울 가자, 아이언 팜, 축제, 장미빛 인생"
20167741,김현호(KIM Hyun-ho),감독,"뽀로로 극장판 보물섬 대모험, 뽀로로 극장판 공룡섬 대모험, 뽀로로 극장판 컴퓨터 왕국 대모험, 뽀로로 극장판 슈퍼썰매 대모험, 뽀로로의 대모험, 뽀로로 극장판 눈요정 마을 대모험"
20312876,앤소니 마라스(Anthony Maras),감독,호텔 뭄바이
10018860,루카 구아다니노(Luca Guadagnino),감독,"서스페리아, 콜 미 바이 유어 네임, 비거 스플래쉬, 베르톨루치가 말하는 베르톨루치 , 아이 엠 러브, 멜리사 P."
10076064,캘리 애스버리(Kelly Asbury),감독,"어글리 돌, 스머프: 비밀의 숲, 노미오와 줄리엣, 슈렉2, 스피릿"
20243469,미즈노 시게노리(Mizuno Shigenori),감독,안도 타다오
20159971,이종언(LEE Jong-un),감독,"생일, 시, 여행자, 밀양, 봄, 처녀네 식당"
10042886,애너 보든(Anna Boden),감독,"캡틴 마블, 이츠 카인드 오브 어 퍼니 스토리, 슈거"
10003461,길예르모 델 토로(Guillermo Del Toro),감독,"퍼시픽 림: 업라이징, 셰이프 오브 워터: 사랑의 모양, 크림슨 피크, 퍼시픽 림, 마마, 헬보이 2 : 골든 아미, 판의 미로 - 오필리아와 세 개의 열쇠, 헬보이, 블레이드 2, 악마의 등뼈, 미믹 , 크로노스"
10013576,크리스찬 하스(Christian Haas),감독,프렌즈: 둥지탈출
10073007,마이클 차베즈(Michael Chaves),감독,요로나의 저주
10000873,강지은(KANG Ji-eun),감독,"크게 될 놈, 고산자, 대동여지도, 강철중: 공공의 적 1-1, 도마뱀, 실미도, 공공의 적"
10017730,로저 미첼(Roger Michell),감독,"위크엔드 인 파리, 굿모닝 에브리원, 사랑을 견뎌내기, 마더, 체인징 레인스, 노팅 힐, 설득"
10041297,아담 맥케이(Adam McKay),감독,"바이스, 빅쇼트, 앵커맨: 더 레전드 컨티뉴, 스탠바이 캅, 스텝 브라더스, 텔라데가 나이트 : 리키 바비의 발라드, 앵커맨"
10009025,닐 마샬(Neil Marshall),감독,"헬보이, 센츄리온, 둠스데이:지구 최후의 날, 디센트, 독 솔져"
20302929,김성기,감독,왓칭
10085431,피에르 모렐(Pierre Morel),감독,"아이 엠 마더, 더 건맨 : 테이큰 감독 뉴프로젝트, 더 건맨, 프롬 파리 위드 러브, 테이큰, 13구역, 트랜스포터"
20235586,데이비드 F. 샌드버그(David F. Sandberg),감독,"샤잠!, 애나벨 : 인형의 주인, 라이트 아웃"
10086265,조던 필(Jordan Peele),감독,"어스, 겟 아웃"
20189699,케빈 콜쉬(Kevin Kolsch),감독,"공포의 묘지, 오디션"
10060348,프랭키 첸(Frankie Chen),감독,"장난스런 키스, 나의 소녀시대"
10061189,저스틴 밸도니(Justin Baldoni),감독,파이브 피트
10081788,팀 버튼(Tim Burton),감독,"덤보, 미스 페레그린과 이상한 아이들의 집, 거울나라의 앨리스, 빅 아이즈, 링컨: 뱀파이어 헌터, 다크 섀도우, 프랑켄위니, 이상한 나라의 앨리스, 스위니 토드 : 어느 잔혹한 이발사 이야기, 유령신부(애니), 찰리와 초콜릿 공장, 빅 피쉬, 혹성탈출, 슬리피 할로우, 팀버튼의 화성침공 , 팀 버튼의 크리스마스 악몽, 배트맨2, 가위손, 프랑켄위니, 빈센트 "
20316812,이창근(LEE Chang-geun),감독,로망
10052420,워시 웨스트모어랜드(Wash Westmoreland),감독,"콜레트, 스틸 앨리스, 달콤한 열여섯"
10057273,이정범(LEE Jeong-beom),감독,"악질경찰, 미씽: 사라진 여자, 우는 남자, 집으로 가는 길, 아저씨, 열혈남아, 귀휴"
10056161,이수진(LEE Su-jin),감독,"우상, 한공주, 적의 사과, 아들의 것, 아빠"
20239886,김지혜(KIM Ji-hye),감독,"썬키스 패밀리, 생생활활"
20318581,신상민(SHIN Sang-min),감독,1919 유관순
10033522,애덤 로비텔(Adam Robitel),감독,"이스케이프 룸, 인시디어스4: 라스트 키, 테이킹"
10078519,클린트 이스트우드(Clint Eastwood),감독,"라스트 미션, 설리: 허드슨강의 기적, 아메리칸 스나이퍼, 저지 보이즈, 내 인생의 마지막 변화구 , J.에드가 - FBI의 시작, 히어애프터, 우리가 꿈꾸는 기적: 인빅터스, 그랜 토리노, 체인질링, 아버지의 깃발, 이오지마에서 온 편지, 밀리언 달러 베이비, 더 블루스: 피아노 블루스, 미스틱 리버, 블러드 워크, 스페이스 카우보이, 클린트 이스트우드: 아웃 오브 섀도우, 트루 크라임, 앱솔루트 파워 , 매디슨 카운티의 다리, 완전한 세상 , 사선에서, 용서받지 못한 자, 후계자, 더티해리 4-써든 임팩트/서든 임팩트, 화이어폭스, 더티 파이터 2, 원 웨이 티켓, 더티 해리3-집행자, 아우트 로, 아이거 빙벽, 대도적, 황야의 스트렌저, 이것이 법이다, 브리지, 어둠속에 벨이 울릴 때, 더티 해리, 사기당한 사람들, 켈리의 영웅들, 집행자, 황야의 무법자, 더티 화이터"
20284809,스도 토모노리(Tomonori Sudo),감독,"페이트 스테이 나이트 헤븐즈필 제2장 로스트 버터플라이, 페이트 스테이 나이트 헤븐즈필 제1장 프레시지 플라워"
10084180,막심 파디브(Maksim Fadeev),감독,정글북: 마법 원정대
10086073,피터 패럴리(Peter Farrelly),감독,"그린 북, 덤 앤 더머 투, 바보 삼총사, 홀 패스, 하트브레이크 키드, 날 미치게하는 남자, 붙어야 산다, 내겐 너무 가벼운 그녀, 미, 마이셀프 앤드 아이린, 메리에겐 뭔가 특별한 것이 있다 , 킹 핀 , 덤 앤 더머 "
10065839,조민호(JOE Min-ho),감독,"항거:유관순 이야기, 10억, 강적, 이공, 정글쥬스, 굿바이 칠드런, 우리시대의 남자 "
20125862,이병헌(LEE Byoung-heon),감독,"극한직업, 레슬러, 바람 바람 바람, 스물, 오늘의 연애, 타짜-신의 손, 힘내세요, 병헌씨, 네버엔딩 스토리, 써니, 과속스캔들, 냄새는 난다"
10058005,이한(LEE Han),감독,"증인, 오빠생각, 손님, 연애의 맛, 오늘의 연애, 우아한 거짓말, 완득이, 내 사랑, 청춘만화, 하늘정원, 연애소설"
10060462,장재현(JANG Jae-hyun),감독,"사바하, 시간위의 집, 검은 사제들, 광해, 왕이 된 남자, 특수본, 바다, 12번째 보조사제, 버스, 인도에서 온 말리, 오오단편극장 - 이학주 배우전, 어둑시니: 두려움을 먹는 자, 제14회 미쟝센 단편영화제 전년도 수상작1, 1월 단편 상상극장-해피 뉴 스타, 제13회 미쟝센 단편영화제 심야의 절대구타 360, 제13회 미쟝센 단편영화제 절대악몽1"
20317199,아르나드 부롱(Arnaud Bouron),감독,숲속왕국의 꿀벌 여왕
10065698,요르고스 란티모스(Giorgos Lanthimos),감독,"더 페이버릿: 여왕의 여자, 킬링 디어, 더 랍스터, 송곳니, 송곳니 감독판, 내 가장 친한 친구"
10051453,라파엘 리바스(Rafael Ribas),감독,리노
10005243,김유성(KIM Ryu-sung),감독,"자전차왕 엄복동, 쓰리 썸머 나잇, 누가 그녀와 잤을까?, 내츄럴시티, 몽정기"
10020816,린 사우더랜드(Lynne Southerland),감독,"신데렐라:마법 반지의 비밀, 뮬란 2"
20313092,박수진(PARK Su-jin),감독,"어쩌다, 결혼"
10013583,딘 데블로이스(Dean Deblois),감독,"드래곤 길들이기 3, 드래곤 길들이기 2, 드래곤 길들이기, 헤이마, 릴로와 스티치"
10016605,로버트 로드리게즈(Robert Rodriguez),감독,"알리타: 배틀 엔젤, 씬 시티: 다크히어로의 부활, 마세티 킬즈, 스파이키드4 : 올더타임인더월드, 마셰티, 쇼츠, 플래닛 테러, 그라인드 하우스, 샤크보이와 라바걸의 모험 : 3-D, 스파이 키드 3D, 원스 어폰 어 타임 인 멕시코 , 스파이 키드 2, 스파이 키드, 패컬티, 황혼에서 새벽까지, 포 룸 , 엘 마리아치"
10077478,크리스토퍼 랜던(Christopher Landon),감독,"해피 데스데이 2 유, 해피 데스데이, 파라노말 액티비티 : 더 마크드 원스"
10077207,크리스 콜럼버스(Chris Columbus),감독,"픽셀, 퍼시 잭슨과 번개 도둑, 아이 러브 유, 베스 쿠퍼, 렌트, 해리포터와 비밀의 방, 해리포터와 마법사의 돌, 바이센테니얼 맨, 스텝맘, 나인 먼쓰 , 미세스 다웃파이어 , 나 홀로 집에 2, 나홀로 집에, 피라미드의 공포, 구니스 , 그렘린 "
10087600,한스 페터 몰란트(Hans Petter Moland),감독,"콜드 체이싱, 미결처리반 Q: 믿음의 음모, 사라짐의 순서, 거품이 사라지면 , 페더젠 동지, 아름다운 나라"
10018173,롭 마샬(Rob Marshall),감독,"메리 포핀스 리턴즈, 숲속으로, 캐리비안의 해적: 낯선 조류, 나인, 게이샤의 추억, 시카고"
20183664,한준희(HAN Jun-hui),감독,"뺑반, 차이나타운, 사이코메트리, 시나리오 가이드"
20115431,야마모토 야스이치로(Yasuichiro Yamamoto),감독,"명탐정 코난: 에피소드 원-작아진 명탐정, 명탐정 코난 : 코난 실종사건 - 사상 최악의 이틀, 명탐정 코난: 11번째 스트라이커, 명탐정 코난: 천공의 난파선, 명탐정 코난:전율의 악보, 명탐정 코난:감벽의 관, 명탐정 코난 : 탐정들의 진혼가 , 명탐정 코난 : 수평선상의 음모, 명탐정 코난:은빛 날개의 마술사"
10022687,마이크 미첼(Mike Mitchell),감독,"레고 무비2, 트롤, 앨빈과 슈퍼밴드3, 슈렉 포에버, 스카이 하이, 서바이빙 크리스마스, 듀스 비갈로"
10006823,나딘 라바키(Nadine Labaki),감독,"가버나움, 사랑해, 리우, 카라멜"
10000970,강효진(KANG Hyo-jin),감독,"내안의 그놈, 양아치 느와르, 폭력의 법칙: 나쁜 피 두 번째 이야기, 미쓰 와이프, 나쁜 피, 육혈포 강도단, 펀치레이디, 맨손으로 죽여라?, 조폭마누라"
20121802,리치 무어(Rich Moore),감독,"주먹왕 랄프 2: 인터넷 속으로, 주토피아, 주먹왕 랄프, 심슨 가족, 퓨쳐라마"
10091491,M. 나이트 샤말란(M. Night Shyamalan),감독,"글래스, 23 아이덴티티, 더 비지트, 애프터 어스, 라스트 에어벤더, 해프닝, 레이디 인 더 워터, 빌리지, 싸인, 언브레이커블, 식스 센스, 와이드 어웨이크"
10031865,브라이언 싱어(Bryan Singer),감독,"보헤미안 랩소디, 엑스맨: 아포칼립스, 엑스맨: 데이즈 오브 퓨처 패스트, 잭 더 자이언트 킬러, 작전명 발키리, 수퍼맨 리턴즈, 엑스맨 2, 엑스맨, 죽음보다 무서운 비밀, 유주얼 서스펙트"
10043130,안드레스 코투리어(Andres Couturier),감독,몬스터 파크
10064265,제임스 완(James Wan),감독,"아쿠아맨, 애나벨 : 인형의 주인, 컨저링 2, 분노의 질주: 더 세븐, 인시디어스: 두번째 집, 컨저링, 인시디어스, 데드 사일런스, 쏘우"
20306533,최신규(CHOI Shin-gyu),감독,"극장판 헬로카봇 : 달나라를 구해줘!, 극장판 헬로카봇: 옴파로스 섬의 비밀, 극장판 공룡메카드: 타이니소어의 섬, 극장판 헬로카봇 : 백악기 시대, 헬로 카봇"
10089218,호소다 마모루(Mamoru Hosoda),감독,"미래의 미라이, 괴물의 아이, 늑대아이, 썸머 워즈, 시간을 달리는 소녀, 원피스 6기 극장판 : 오마츠리 남작과 비밀의 섬, 게게게 키타로: 키타로의 유령전철"
20245489,트래비스 나이트(Travis Knight),감독,"범블비, 쿠보와 전설의 악기"
10004291,김병우(KIM Byung-woo),감독,"PMC: 더 벙커, 더 테러 라이브, 리튼, 아나모픽"
10000946,강형철(KANG Hyoung-chul),감독,"스윙키즈, 타짜-신의 손, 써니 감독판, 써니, 과속스캔들"
20312035,한상호,감독,"점박이 한반도의 공룡2 : 새로운 낙원, 점박이:한반도의 공룡3D"
20111283,우민호(WOO Min-ho),감독,"남산의 부장들, 마약왕, 내부자들: 디 오리지널, 내부자들, 간첩, 파괴된 사나이, 누가 예수를 죽였는가?"
20114371,타카하시 와타루(Wataru Takahashi),감독,"극장판 짱구는 못말려: 아뵤! 쿵후 보이즈 ~라면 대란~, 짱구는 못말려 극장판: 폭풍수면! 꿈꾸는 세계 대돌격, 짱구는 못말려 극장판 : 정면승부! 로봇아빠의 역습, 극장판 아따맘마3D : 엄마는 초능력자"
10062679,밥 퍼시케티(Bob Persichetti),감독,스파이더맨: 뉴 유니버스
10072117,최국희(CHOI Kook-hee),감독,"국가부도의 날, 스플릿, 8월의 일요일들, 극장전, 그날 밤의 축제, 삶은 전진하고, 청춘, 외대앞, 블루 디코딩"
10054870,이권(LEE Kwon),감독,"도어락, 타이밍, 내 연애의 기억, 어깨 너머의 연인, 꽃미남 연쇄 테러 사건, 서프라이즈, 고양이를 부탁해, 겁쟁이들이 더 흉폭하다"
10050389,야지마 테츠오(Tetsuo Yajima),감독,극장판 포켓몬스터 모두의 이야기
10013865,라세 할스트롬(Lasse Hallstrom),감독,"호두까기 인형과 4개의 왕국, 베일리 어게인, 로맨틱 레시피, 세이프 헤이븐, 최면 전문의, 사막에서 연어낚시, 디어 존, 하치 이야기, 혹스: 욕망의 법칙, 카사노바, 언피니쉬드 라이프, 쉬핑 뉴스, 초콜릿, 사이더 하우스, 줄리아 로버츠의 사랑게임, 길버트 그레이프, 아바"
10083870,폴 페이그(Paul Feig),감독,"부탁 하나만 들어줘, 고스트버스터즈, 스파이, 더 히트, 내 여자친구의 결혼식, 성탄절 전야의 공항 대소동, 아이 엠 데이빗"
10051181,크리스찬 리버스(Christian Rivers),감독,모털 엔진
10054516,윤준상(YOON Jun-sang),감독,"런닝맨 : 풀룰루의 역습, 초혼"
20111735,이재규(LEE Jae-kyoo),감독,"완벽한 타인, 역린, 인플루언스"
20304809,김민호(KIM Min-ho),감독,성난황소
10009928,오토 바서스트(Otto Bathurst),감독,후드
20100014,데이빗 예이츠(David Yates),감독,"신비한 동물들과 그린델왈드의 범죄, 신비한 동물사전, 레전드 오브 타잔, 해리포터와 죽음의 성물2, 해리 포터와 죽음의 성물1, 해리 포터와 혼혈 왕자, 해리 포터와 불사조 기사단, 카페의 소녀"
10013865,라세 할스트롬(Lasse Hallstrom),감독,"호두까기 인형과 4개의 왕국, 베일리 어게인, 로맨틱 레시피, 세이프 헤이븐, 최면 전문의, 사막에서 연어낚시, 디어 존, 하치 이야기, 혹스: 욕망의 법칙, 카사노바, 언피니쉬드 라이프, 쉬핑 뉴스, 초콜릿, 사이더 하우스, 줄리아 로버츠의 사랑게임, 길버트 그레이프, 아바"
10046021,앤드류 하얏트(Andrew Hyatt),감독,바울
20178840,페드 알바레즈(Fede Alvarez),감독,"거미줄에 걸린 소녀, 맨 인 더 다크, 이블 데드"
10032981,빅터 아즈에프(Victor Azeev),감독,투 프렌즈
20311772,박준수,감독,"브링 더 소울 : 더 무비, 번 더 스테이지: 더 무비"
10063620,제이슨 라이트맨(Jason Reitman),감독,"고스트버스터즈 2020, 툴리, 멘, 우먼 & 칠드런, 레이버 데이, 영 어덜트, 인 디 에어, 주노, 흡연, 감사합니다"
20311469,우시지마 신이치로(Shinichiro Ushijima),감독,너의 췌장을 먹고 싶어
10058831,임진순(LIM Jin-sun),감독,"동네사람들, 슈퍼스타, 해적 디스코왕 되다, 일월영측, 원격조정"
20309609,김정환,감독,해피 투게더
20128773,김성훈(KIM Sung-hoon),감독,"창궐, 공조, 마이 리틀 히어로"
10077207,크리스 콜럼버스(Chris Columbus),감독,"픽셀, 퍼시 잭슨과 번개 도둑, 아이 러브 유, 베스 쿠퍼, 렌트, 해리포터와 비밀의 방, 해리포터와 마법사의 돌, 바이센테니얼 맨, 스텝맘, 나인 먼쓰 , 미세스 다웃파이어 , 나 홀로 집에 2, 나홀로 집에, 피라미드의 공포, 구니스 , 그렘린 "
20157236,유영선(YOO Young-sun),감독,"여곡성, 마녀, 동면의 소녀, 마녀+동면의 소녀"
10058386,일라이 로스(Eli Roth),감독,"벽 속에 숨은 마법시계, 데스 위시, 그린 인페르노, 노크 노크, 애프터쇼크, 그라인드 하우스, 호스텔 2, 호스텔, 캐빈 피버"
10045012,아리 산델(Ari Sandel),감독,"구스범스: 몬스터의 역습, 퀸카가 아니어도 좋아, 와일드 웨스트 코미디 쇼"
10011631,데이빗 고든 그린(David Gordon Green),감독,"할로윈, 스트롱거, 맹글혼, 조, 프린스 아발란체, 더 시터, 유어 하이니스, 파인애플 익스프레스, 스노우 엔젤스, 올 더 리얼 걸스, 언더토우, 조지 워싱턴"
10006086,김태균(KIM Tae-gyun),감독,"암수살인, 봄, 눈, 써클, 세이예스, 신장개업, 닥터 K, 억수탕(3pm Paradise), 반짝반짝 두근두근, 2015 GSFF 배우 특별전: 김수안 , [PDFF2015] 장애인미디어운동1 + 한국영화초청3"
10057572,이지원(LEE Ji-won),감독,"미쓰백, 우아한 세계, 주홍글씨, 번지점프를 하다, 그녀에게, 판타스틱 자살소동"
10068277,존 추(Jon Chu),감독,"크레이지 리치 아시안, 나우 유 씨 미 2, 지.아이.조 2, 저스틴 비버 : 네버 세이 네버, 스텝 업 3D, 스텝업 2 : 더 스트리트"
10009698,데이미언 셔젤(Damien Chazelle),감독,"퍼스트맨, 라라랜드, 위플래쉬"
20120723,루벤 플레셔(Ruben Fleischer),감독,"베놈, 갱스터 스쿼드, 털기 아니면 죽기 : 제한시간 30분, 좀비랜드"
10024440,마크 포스터(Marc Forster),감독,"곰돌이 푸 다시 만나 행복해, 월드 워 Z, 머신건 프리처 감독판, 머신건 프리처, 007 퀀텀 오브 솔러스, 연을 쫓는 아이, 스트레인저 댄 픽션, 스테이, 네버랜드를 찾아서, 몬스터 볼"
10003620,김광식(KIM Kwang-sik),감독,"안시성, 찌라시: 위험한 소문, 내 깡패 같은 애인, 오프 로드, 오아시스, 얼굴, 억수탕(3pm Paradise), 비천괴수"
20305089,박진영(PARK Jin-young),감독,배반의 장미
10056329,이시다 히로야스(Hiroyasu Ishida),감독,"펭귄 하이웨이, 태양소년 이슬소녀, 비오는 마을, 후미코의 고백, 이시다 히로야스 X 아라이 요지로 특별전"
10086194,올리버 달리(Oliver Daly),감독,액슬
10044124,마이크 데블린(Mike Devlin),감독,"다이노 어드벤처: 에일리언 월드, 다이노 어드벤처2: 육해공 공룡 대백과, 다이노 어드벤처: 뉴 자이언트, 다이노 어드벤처: 육해공 킬러 엘리트"
10068081,존 스티븐슨(John Stevenson),감독,"셜록 놈즈, 쿵푸 팬더"
20114792,이종석(LEE Jong-seok),감독,"협상, 그것만이 내 세상, 히말라야, 국제시장, 더 킥, 리턴"
10023193,마이클 수지(Michael Sucsy),감독,"에브리데이, 서약, 그레이 가든스"
10029586,박희곤(PARK Hee-gon),감독,"명당, 챔피언, 퍼펙트 게임, 인사동 스캔들, 아 유 레디?"
10066770,조원희(JO Won-hee),감독,"원더풀 고스트, 죽이고 싶은, 애니 프란체스카"
10076618,코린 하디(Corin Hardy),감독,더 넌
10011005,아니쉬 차간티(Aneesh Chaganty),감독,서치
20171642,우시로 신지(Shinji Ushiro),감독,"극장판 요괴워치 섀도사이드: 도깨비왕의 부활, 극장판 요괴워치: 하늘을 나는 고래와 더블세계다냥!, 극장판 요괴워치: 탄생의 비밀이다냥!, 스트레이트 재킷"
10052360,울프강 라우엔슈타인(Wolfgang Lauenstein),감독,루이스
10080742,닛타 노리오(Norio Nitta),감독,"에그엔젤 코코밍: 두근두근 핼러윈 파티, 극장판 에그엔젤 코코밍: 푸르밍과 두근두근 코코밍 세계"
20309473,정미화,감독,극장판 뽀잉: 슈퍼 변신의 비밀
10088447,허종호(HUH Jong-ho),감독,"물괴, 성난 변호사, 카운트다운, 눈부신 날에, 얼굴값, 승부"
10055945,이석근(LEE Seok-keun),감독,"너의 결혼식, 부라더, 범죄도시, 누가 예수를 죽였는가?"
10037886,쉐인 블랙(Shane Black),감독,"더 프레데터, 나이스 가이즈, 언럭키맨, 아이언맨 3, 키스 키스 뱅뱅, 롱 키스 굿나잇 "
10031397,변혁(BYUN Daniel H.),감독,"상류사회, 주홍글씨, 서프라이즈, 인터뷰, 올슨, His Concern, 어머니의 여름, 호모 비디오쿠스"
10051071,올 파커(Ol Parker),감독,"맘마미아!2, 나우이즈굿 , 베스트 엑조틱 메리골드 호텔, 이매진 미 앤 유"
10005151,김용화(KIM Yong-hwa),감독,"백두산, 신과함께-인과 연, 신과함께-죄와 벌, 미스터 고, 마이 웨이, 국가대표 완결판-못 다한 이야기, 국가대표, 미녀는 괴로워, 오! 브라더스, 자반고등어"
10054495,윤종빈(YOON Jong-bin),감독,"공작, 춘몽, 검사외전, 허삼관, 군도: 민란의 시대, 범죄와의 전쟁: 나쁜놈들 전성시대, 비스티 보이즈, 용서받지 못한 자"
10065265,조규장(CHO Kyu-jang),감독,"목격자, 그날의 분위기, 낙타는 말했다, 봉수"
10029772,발타자르 코루마쿠르(Baltasar Kormakur),감독,"어드리프트:우리가 함께한 바다, 오스, 에베레스트, 투건스, 콘트라밴드, 살인의 기억, 천국으로 가는 초라한 여행, 폭풍의 계절, 보이지 않는 세계, 성난 바다, 레이캬비크, 버림받은 천사들, 분열, 아그네스의 원죄 "
10086171,수잔나 포겔(Susanna Fogel),감독,나를 차버린 스파이
