영화인 코드,영화인명,분야,필모리스트
10077515,크리스토퍼 맥쿼리(Christopher McQuarrie),감독,"미션 임파서블: 폴아웃, 미션 임파서블: 로그네이션, 잭 리처, 웨이 오브 더 건, 유주얼 서스펙트"
10045281,알폰소 쿠아론(Alfonso Cuaron),감독,"로마, 그래비티, 칠드런 오브 맨, 해리포터와 아즈카반의 죄수, 이투마마, 위대한 유산 , 러브 앤 히스테리, 도대체 그 남자가 누구야"
10001386,젠디 타타코브스키(Genndy Tartakovsky),감독,"몬스터 호텔 3, 몬스터 호텔 2, 몬스터 호텔"
10068421,존 터틀타웁(Jon Turteltaub),감독,"메가로돈, 라스트베가스, 마법사의 제자, 내셔널 트레져:비밀의 책, 내셔널 트레져, 키드, 인스팅트 , 페노메논 , 당신이 잠든 사이에 "
10085782,피터 버그(Peter Berg),감독,"마일22, 패트리어트 데이, 딥워터 호라이즌, 론 서바이버 , 배틀쉽, 핸콕, 킹덤, 프라이데이 나잇 라이트, 웰컴 투 더 정글, 코르키 로마노, 베리배드씽, 기적의 터치다운, 질주, 영혼의 목걸이"
10055319,이마이 카즈아키(Kazuaki Imai),감독,극장판 도라에몽: 진구의 보물섬
10021027,타치카와 유즈루(Yuzuru Tachikawa),감독,명탐정 코난 : 제로의 집행인
20306533,최신규(CHOI Shin-gyu),감독,"극장판 헬로카봇 : 달나라를 구해줘!, 극장판 헬로카봇: 옴파로스 섬의 비밀, 극장판 공룡메카드: 타이니소어의 섬, 극장판 헬로카봇 : 백악기 시대, 헬로 카봇"
10032042,브래드 버드(Brad Bird),감독,"인크레더블 2, 투모로우랜드, 미션임파서블:고스트프로토콜, 라따뚜이, 인크레더블, 심슨 가족, 아이언 자이언트"
10004265,김병갑(KIM Byung-gap),감독,"신비아파트: 금빛 도깨비와 비밀의 동굴, 마당을 나온 암탉, 쩨쩨한 로맨스, 마법천자문: 대마왕의 부활을 막아라, 아치와 씨팍, 왕후 심청"
20070799,고레에다 히로카즈(Hirokazu Koreeda),감독,"어느 가족, 세 번째 살인, 태풍이 지나가고, 바닷마을 다이어리, 그렇게 아버지가 된다, 엔딩노트, 진짜로 일어날지도 몰라 기적, 공기인형, 걸어도 걸어도, 하나, 아무도 모른다, 디스턴스, 원더풀 라이프, 환상의 빛, 그러나... 복지를 버리는 시대로, 또 하나의 교육"
10005852,김지운(KIM Jee-woon),감독,"인랑, 밀정, 라스트 스탠드, 악마를 보았다, 악마를 보았다 감독판, 좋은 놈, 나쁜 놈, 이상한 놈 , 좋은 놈, 나쁜 놈, 이상한 놈(칸버전), 감독들, 김기영을 말하다, 달콤한 인생, 장화, 홍련, 쓰리, 쓰리 메모리즈, 반칙왕, 커밍 아웃, 조용한 가족, 더 엑스, 사랑의 가위바위보, 선물, 사랑의 힘, 제13회 미쟝센 단편영화제 김지운 단편 특별전1, 제13회 미쟝센 단편영화제 김지운 단편 특별전2, 제13회 미쟝센 단편영화제 김지운 감독 마스터클래스, 인류멸망 보고서, 인류 멸망 보고서 '천상의 피조물' "
10083194,페이튼 리드(Peyton Reed),감독,"앤트맨과 와스프, 앤트맨, 예스맨, 브레이크 업 : 이별후애(愛), 다운 위드 러브, 브링잇온"
10029578,박훈정(PARK Hoon-jung),감독,"마녀, 브이아이피, 대호, 신세계, 혈투, 부당거래, 악마를 보았다"
10017517,로슨 마샬 터버(Rawson Marshall Thurber),감독,"스카이스크래퍼, 위 아 더 밀러스, 피츠버그의 미스터리, 피구의 제왕"
10058049,이해영(LEE Hae-young),감독,"독전: 익스텐디드 컷, 독전, 경성학교: 사라진 소녀들, 26년, 페스티발, 천하장사 마돈나, 아라한 장풍대작전, 안녕! 유에프오, 품행제로, 신라의 달밤, 커밍 아웃"
10025841,마이클 메이슨(Michael Mason),감독,신은 죽지 않았다 3: 어둠 속의 빛
